{
  "page_title": "Como Fazer Crochê Passo a Passo - Guia Completo para Iniciantes 2024",
  "page_model": "modelo_v1",
  "page_template": "pressel-oficial.php",
  "post_status": "publish",
  "acf_fields": {
    "hero_description": "Aprenda todas as técnicas essenciais de crochê de forma simples, rápida e totalmente gratuita com nossos tutoriais passo a passo",
    "link_h1": "",
    "botao_tipo_selecao": "normal",
    "titulo_da_secao": "Acesse os Melhores Tutoriais de Crochê Gratuitamente",
    "cor_botao": "#FF6B9D",
    "texto_botao_p1": "Tutoriais para Iniciantes",
    "link_botao_p1": "https://exemplo.com/tutoriais-iniciantes",
    "texto_botao_p2": "Técnicas Avançadas",
    "link_botao_p2": "https://exemplo.com/tecnicas-avancadas",
    "texto_botao_p3": "Padrões Gratuitos",
    "link_botao_p3": "https://exemplo.com/padroes-gratuitos",
    "texto_usuario": "Você permanecerá no mesmo site",
    "titulo_h2_": "O Que é Crochê e Por Que Você Deveria Aprender?",
    "info_content": "<p>O crochê é uma técnica milenar de tecelagem manual que utiliza apenas uma agulha e linha para criar peças incríveis. Desde roupas elegantes até itens decorativos para o lar, as possibilidades são infinitas quando você domina esta arte.</p><p>Diferente do tricô que usa duas agulhas, o crochê trabalha com uma única agulha de ponta curva, tornando a técnica mais versátil e acessível para iniciantes. Você pode criar desde pequenos acessórios até grandes mantas e cobertores com facilidade.</p><p>Além de ser uma atividade relaxante e terapêutica, o crochê tem se tornado cada vez mais popular como fonte de renda extra. Muitas pessoas transformaram seu hobby em um negócio lucrativo, vendendo suas criações artesanais online e em feiras de artesanato.</p><p>Com dedicação e os tutoriais certos, qualquer pessoa pode aprender crochê, independentemente da idade ou experiência prévia. O importante é começar com projetos simples e ir evoluindo gradualmente conforme ganha confiança e habilidade.</p>",
    "titulo_h2_02": "Como Começar no Crochê: Materiais e Primeiros Passos",
    "info_content_2": "<p>Para começar sua jornada no crochê, você precisará de poucos materiais básicos: uma agulha de crochê (recomendamos tamanho 3.5mm ou 4mm para iniciantes), linha de crochê de qualidade média e uma tesoura. Não é necessário investir muito dinheiro no início - materiais simples são suficientes para aprender.</p><p>O primeiro passo é aprender os pontos básicos: corrente, ponto baixo e ponto alto. Estes três pontos formam a base de praticamente todos os projetos de crochê. Pratique cada ponto separadamente até conseguir fazê-los de forma consistente e uniforme.</p><p>Escolha um projeto inicial simples, como um quadrado ou retângulo básico, que pode se transformar em um porta-copos ou paninho de prato. Projetos pequenos são ideais para iniciantes porque permitem ver resultados rápidos, mantendo a motivação alta enquanto você desenvolve suas habilidades.</p>",
    "titulo_beneficios": "Por Que Milhares de Pessoas Estão Aprendendo Crochê?",
    "titulo_beneficios_1": "Relaxamento e Bem-Estar",
    "_beneficio_text_1": "O crochê funciona como uma meditação ativa, reduzindo significativamente os níveis de estresse e ansiedade enquanto você cria algo bonito",
    "titulo_beneficios_2": "Criatividade Ilimitada",
    "_beneficio_text_2": "Desenvolva sua criatividade criando peças únicas e personalizadas que expressam seu estilo e personalidade",
    "titulo_beneficios_3": "Fonte de Renda Extra",
    "_beneficio_text_3": "Transforme seu hobby em um negócio lucrativo vendendo suas criações em marketplaces, redes sociais e feiras locais",
    "titulo_beneficios_4": "Comunidade Acolhedora",
    "_beneficio_text_4": "Faça parte de uma comunidade global apaixonada, compartilhando ideias, padrões e experiências com outros entusiastas",
    "titulo_faq": "Perguntas Frequentes Sobre Aprender Crochê",
    "pergunta_1": "Quanto tempo leva para aprender crochê do zero?",
    "resposta_1": "Com prática diária de 30 minutos a 1 hora, a maioria das pessoas consegue dominar os pontos básicos em 2 a 3 semanas. Em 2 a 3 meses, você já será capaz de criar projetos intermediários com confiança. O importante é praticar consistentemente e não desistir nos primeiros dias.",
    "pergunta_2": "Quais materiais eu preciso para começar a fazer crochê?",
    "resposta_2": "Para começar, você precisa apenas de uma agulha de crochê (tamanho 3.5mm ou 4mm é ideal para iniciantes), linha de crochê de qualidade média e uma tesoura. Opcionalmente, um marcador de pontos e uma agulha de tapeçaria para finalizar as peças são úteis. O investimento inicial é muito baixo, tornando o crochê acessível para todos.",
    "pergunta_3": "Crochê é difícil de aprender? Consigo aprender sozinho?",
    "resposta_3": "Não, crochê não é difícil! Com os tutoriais em vídeo e passo a passo disponíveis gratuitamente, você pode aprender sozinho tranquilamente. A técnica básica é simples e repetitiva, facilitando a memorização. Milhares de pessoas aprendem crochê por conta própria todos os dias - se elas conseguiram, você também consegue!",
    "aviso": "aviso_pt"
  },
  "seo": {
    "meta_title": "Como Fazer Crochê: Guia Completo para Iniciantes 2024",
    "meta_description": "Aprenda crochê do zero com nosso guia completo. Tutoriais passo a passo, técnicas essenciais, padrões gratuitos e dicas profissionais para iniciantes e avançados.",
    "focus_keyword": "como fazer crochê"
  },
  "featured_image": ""
}

